{
  "id": "process-line",
  "name": "Process line",
  "gridCellSize": 1,
  "objects": [
    { "id": "supply-slab", "object": "area", "x": 4.2, "y": -13.2, "width": 14.5, "height": 8.4 },

    { "id": "holding", "object": "tank", "x": 1, "y": -1, "params": { "level": 0.12 }, "height": 3.05, "fillColor": "#2f7eb8" },
    { "id": "mixer", "object": "mixer", "x": 3.9, "y": -4.42, "params": { "level": 0.52 }, "height": 2.7, "fillColor": "#18BAE6" },
    { "id": "ingredient-a", "object": "tank", "x": 0.5, "y": -10.72, "params": { "level": 0.12 }, "height": 3.05, "fillColor": "#2a6fa8" },
    { "id": "ingredient-b", "object": "tank", "x": 6.82, "y": -10.73, "params": { "level": 0.12 }, "height": 3.05, "fillColor": "#2a6fa8" },

    { "id": "pipe-packaging", "object": "pipe", "x": 1, "y": 0, "toX": 1, "toY": 1.5, "band": "#c0392b" },
    { "id": "pipe-packaging-b", "object": "pipe", "x": 1, "y": 1.5, "toX": 1, "toY": 2.7, "band": "#ffffff" },
    { "id": "pipe-packaging-end", "object": "pipe", "x": 1, "y": 2.7, "toX": -2, "toY": 2.7, "band": "#ffffff" },
    { "id": "pipe-holding-mixer-x", "object": "pipe", "x": 2, "y": -1, "toX": 4, "toY": -1, "band": "#c0392b" },
    { "id": "pipe-holding-mixer-y", "object": "pipe", "x": 4, "y": -1, "toX": 4, "toY": -3.42, "band": "#c0392b" },

    { "id": "pipe-a-v", "object": "pipe", "x": 4, "y": -5.42, "toX": 4, "toY": -9.72, "band": "#e74c3c" },
    { "id": "pipe-a-h", "object": "pipe", "x": 4, "y": -9.72, "toX": 0.5, "toY": -9.72, "band": "#e74c3c" },
    { "id": "pipe-b-v", "object": "pipe", "x": 5, "y": -4.42, "toX": 5, "toY": -9.67, "band": "#e74c3c" },
    { "id": "pipe-b-h", "object": "pipe", "x": 5, "y": -9.67, "toX": 6.82, "toY": -9.67, "band": "#e74c3c" },

    { "id": "pipe-a-in", "object": "pipe", "x": 0.5, "y": -11.72, "toX": 0.5, "toY": -15.25, "band": "#f1c40f" },
    { "id": "pipe-b-in", "object": "pipe", "x": 6.82, "y": -11.73, "toX": 6.82, "toY": -15.2, "band": "#e67e22" },
    { "id": "pipe-steam-x", "object": "pipe", "x": 5, "y": -4.42, "toX": 9.08, "toY": -4.42, "band": "#27ae60" },
    { "id": "pipe-steam-y", "object": "pipe", "x": 9.08, "y": -4.42, "toX": 9.08, "toY": -0.9, "band": "#27ae60" },
    { "id": "pipe-steam-out", "object": "pipe", "x": 9.08, "y": -0.9, "toX": 10.5, "toY": -0.9, "band": "#27ae60" },
    { "id": "pipe-steam-out-b", "object": "pipe", "x": 10.5, "y": -0.9, "toX": 12.9, "toY": -0.9, "band": "#ffffff" },

    { "id": "elbow-holding-mixer", "object": "elbow", "x": 4, "y": -1, "rotation": 0 },
    { "id": "elbow-mixer-front", "object": "elbow", "x": 4, "y": -3.42 },
    { "id": "elbow-mixer-a", "object": "elbow", "x": 4, "y": -5.42 },
    { "id": "elbow-mixer-b", "object": "elbow", "x": 5, "y": -4.42 },
    { "id": "elbow-a-turn", "object": "elbow", "x": 4, "y": -9.72, "rotation": 1.5707963267948966 },
    { "id": "elbow-a-front", "object": "elbow", "x": 0.5, "y": -9.72 },
    { "id": "elbow-b-turn", "object": "elbow", "x": 5, "y": -9.67, "rotation": 3.141592653589793 },
    { "id": "elbow-b-front", "object": "elbow", "x": 6.82, "y": -9.67 },
    { "id": "elbow-packaging", "object": "elbow", "x": 1, "y": 2.7, "rotation": 0 },
    { "id": "elbow-steam", "object": "elbow", "x": 9.08, "y": -4.42, "rotation": 1.5707963267948966 },
    { "id": "elbow-steam-out", "object": "elbow", "x": 9.08, "y": -0.9, "rotation": -1.5707963267948966 },
    { "id": "elbow-a-in", "object": "elbow", "x": 0.5, "y": -11.72 },
    { "id": "elbow-b-in", "object": "elbow", "x": 6.82, "y": -11.73 },

    { "id": "valve-packaging", "object": "valve", "x": 1, "y": 0.4, "onPipe": "pipe-packaging", "at": 0.267, "rotation": 1.5707963267948966, "handwheel": "#9b713d" },
    { "id": "valve-holding-out", "object": "valve", "x": 3, "y": -1, "onPipe": "pipe-holding-mixer-x", "at": 0.5, "handwheel": "#9b713d" },
    { "id": "valve-a", "object": "valve", "x": 1.36, "y": -9.4, "handwheel": "#c0392b" },
    { "id": "valve-b", "object": "valve", "x": 5.72, "y": -9.67, "onPipe": "pipe-b-h", "at": 0.396, "handwheel": "#c0392b" },
    { "id": "valve-a-in", "object": "valve", "x": 0.5, "y": -14.55, "onPipe": "pipe-a-in", "at": 0.802, "rotation": 1.5707963267948966, "handwheel": "#9b713d" },
    { "id": "valve-b-in", "object": "valve", "x": 6.82, "y": -14.5, "onPipe": "pipe-b-in", "at": 0.798, "rotation": 1.5707963267948966, "handwheel": "#9b713d" },
    { "id": "valve-steam", "object": "valve", "x": 8.89, "y": -1.4, "rotation": 1.5707963267948966, "handwheel": "#27ae60" },
    { "id": "cap-steam", "object": "end-cap", "x": 11.72, "y": -0.9 },

    { "id": "label-holding", "object": "label", "x": 4.5, "y": 0.05, "params": { "text": "Holding\nTank" }, "size": 0.3, "height": 0.08, "screenX": 218, "screenY": 358 },
    { "id": "label-packaging", "object": "label", "x": 0.15, "y": 2.4, "params": { "text": "Out to Packaging" }, "size": 0.28, "height": 0.12, "screenX": 88, "screenY": 343 },
    { "id": "label-a-in", "object": "label", "x": 1.1, "y": -14.9, "params": { "text": "A Input" }, "size": 0.32, "height": 0.12, "screenX": 542, "screenY": 133 },
    { "id": "chevron-a", "object": "label", "x": 0.5, "y": -15.25, "params": { "text": "«" }, "size": 0.4, "height": 0.12, "screenX": 520, "screenY": 132 },
    { "id": "chevron-packaging", "object": "label", "x": -2, "y": 2.7, "params": { "text": "«" }, "size": 0.5, "height": 0.12, "screenX": 16, "screenY": 334 },
    { "id": "label-supply", "object": "label", "x": 3.2, "y": -10.5, "params": { "text": "Supply\nTanks" }, "size": 0.32, "height": 0.12, "screenX": 488, "screenY": 208 },
    { "id": "label-ingredient-a", "object": "label", "x": -3.2, "y": -10.2, "params": { "text": "Ingredient A" }, "size": 0.34, "height": 0.12, "screenX": 330, "screenY": 124 },
    { "id": "label-ingredient-b", "object": "label", "x": 9.0, "y": -10.15, "params": { "text": "Ingredient B" }, "size": 0.34, "height": 0.12, "screenX": 630, "screenY": 294 },
    { "id": "label-b-in", "object": "label", "x": 7.15, "y": -14.85, "params": { "text": "B Input" }, "size": 0.32, "height": 0.12, "screenX": 685, "screenY": 211 },
    { "id": "chevron-b", "object": "label", "x": 6.82, "y": -15.2, "params": { "text": "«" }, "size": 0.4, "height": 0.12, "screenX": 648, "screenY": 207 },
    { "id": "label-temp", "object": "label", "x": 4.2, "y": -7.6, "params": { "text": "Temperature:" }, "color": "#e67e22", "size": 0.24, "height": 0.12, "screenX": 438, "screenY": 302 },
    { "id": "label-temp-val", "object": "label", "x": 11.9, "y": -3.25, "params": { "text": "14 deg" }, "color": "#e67e22", "size": 0.24, "height": 0.12, "screenX": 542, "screenY": 326 },
    { "id": "label-rpm", "object": "label", "x": 4.2, "y": -7.05, "params": { "text": "Mixer RPM:" }, "color": "#888888", "size": 0.24, "height": 0.12, "screenX": 432, "screenY": 314 },
    { "id": "label-rpm-val", "object": "label", "x": 11.5, "y": -3.0, "params": { "text": "0" }, "color": "#888888", "size": 0.24, "height": 0.12, "screenX": 536, "screenY": 338 },
    { "id": "label-pressure", "object": "label", "x": 9.65, "y": -1.15, "params": { "text": "Pressure 8 PSI" }, "color": "#27ae60", "size": 0.26, "height": 0.12, "screenX": 358, "screenY": 420 },
    { "id": "label-steam", "object": "label", "x": 12.45, "y": -0.2, "params": { "text": "Steam Out" }, "color": "#e74c3c", "size": 0.24, "height": 0.12, "screenX": 464, "screenY": 444 }
  ]
}
