{
  "id": "brewhouse",
  "name": "Brewhouse",
  "gridCellSize": 1,
  "theme": "brewery",
  "objects": [
    {"id": "area", "object": "area", "x": 15.5, "y": 7.75, "width": 29, "height": 8.7},
    {"id": "hlt", "object": "brewery:hlt", "x": 3, "y": 8, "params": {"level": 60, "tempC": 74, "radius": 1.0, "height": 3.0}, "extensions": {"hyperdrive.bindings": {"metrics": {"level": "brewhouse-plc:Brewhouse.HltLevelPct", "tempC": "brewhouse-plc:Brewhouse.HltTempC"}}}},
    {"id": "mash-tun", "object": "brewery:mash-tun", "x": 10, "y": 5, "params": {"level": 50, "tempC": 66, "agitatorRpm": 0, "radius": 1.0, "height": 1.7}, "extensions": {"hyperdrive.bindings": {"metrics": {"level": "brewhouse-plc:Brewhouse.MashTunLevelPct", "tempC": "brewhouse-plc:Brewhouse.MashTunTempC", "agitatorRpm": "brewhouse-plc:Brewhouse.MashTunAgitatorRpm"}}}},
    {"id": "kettle", "object": "brewery:kettle", "x": 17.5, "y": 5, "params": {"level": 50, "tempC": 20, "agitatorRpm": 0, "radius": 0.65, "height": 2.2}, "extensions": {"hyperdrive.bindings": {"metrics": {"level": "brewhouse-plc:Brewhouse.KettleLevelPct", "tempC": "brewhouse-plc:Brewhouse.KettleTempC", "agitatorRpm": "brewhouse-plc:Brewhouse.KettleAgitatorRpm"}}}},
    {"id": "whirlpool", "object": "brewery:whirlpool", "x": 24, "y": 8, "params": {"level": 0, "tempC": 20, "agitatorRpm": 0, "radius": 1.0, "height": 1.5}, "extensions": {"hyperdrive.bindings": {"metrics": {"level": "brewhouse-plc:Brewhouse.WhirlpoolLevelPct", "tempC": "brewhouse-plc:Brewhouse.WhirlpoolTempC", "agitatorRpm": "brewhouse-plc:Brewhouse.WhirlpoolAgitatorRpm"}}}},
    {"id": "p-hlt-out", "object": "pipe", "x": 4, "y": 8, "toX": 7, "toY": 8, "band": "#c8792a"},
    {"id": "e-hlt", "object": "elbow", "x": 7, "y": 8, "params": {"bend": "auto"}},
    {"id": "p-hlt-up", "object": "pipe", "x": 7, "y": 8, "toX": 7, "toY": 5, "band": "#c8792a"},
    {"id": "e-mt-in", "object": "elbow", "x": 7, "y": 5, "params": {"bend": "auto"}},
    {"id": "p-mt-in", "object": "pipe", "x": 7, "y": 5, "toX": 9, "toY": 5, "band": "#c8792a"},
    {"id": "p-mt-out", "object": "pipe", "x": 11, "y": 5, "toX": 16.8, "toY": 5, "band": "#c8792a"},
    {"id": "p-k-out", "object": "pipe", "x": 18.1, "y": 5, "toX": 21, "toY": 5, "band": "#c8792a"},
    {"id": "e-k-out", "object": "elbow", "x": 21, "y": 5, "params": {"bend": "auto"}},
    {"id": "p-wp-down", "object": "pipe", "x": 21, "y": 5, "toX": 21, "toY": 8, "band": "#c8792a"},
    {"id": "e-wp-in", "object": "elbow", "x": 21, "y": 8, "params": {"bend": "auto"}},
    {"id": "p-wp-in", "object": "pipe", "x": 21, "y": 8, "toX": 23, "toY": 8, "band": "#c8792a"},
    {"id": "p-wp-out", "object": "pipe", "x": 25, "y": 8, "toX": 29, "toY": 8, "band": "#c8792a"},
    {"id": "cap-wp-out", "object": "end-cap", "x": 29, "y": 8},
    {"id": "v-hlt-out", "object": "valve", "x": 4.6, "y": 8, "handwheel": "#c0392b", "params": {"open": false}, "extensions": {"hyperdrive.bindings": {"metrics": {"open": "brewhouse-plc:Brewhouse.HltOutOpen"}}}},
    {"id": "v-mt-in", "object": "valve", "x": 8.2, "y": 5, "handwheel": "#8a5a2b", "params": {"open": false}, "extensions": {"hyperdrive.bindings": {"metrics": {"open": "brewhouse-plc:Brewhouse.MtInOpen"}}}},
    {"id": "v-mt-out", "object": "valve", "x": 11.8, "y": 5, "handwheel": "#c0392b", "params": {"open": false}, "extensions": {"hyperdrive.bindings": {"metrics": {"open": "brewhouse-plc:Brewhouse.MtOutOpen"}}}},
    {"id": "v-k-in", "object": "valve", "x": 15.7, "y": 5, "handwheel": "#8a5a2b", "params": {"open": false}, "extensions": {"hyperdrive.bindings": {"metrics": {"open": "brewhouse-plc:Brewhouse.KInOpen"}}}},
    {"id": "v-k-out", "object": "valve", "x": 19.2, "y": 5, "handwheel": "#c0392b", "params": {"open": false}, "extensions": {"hyperdrive.bindings": {"metrics": {"open": "brewhouse-plc:Brewhouse.KOutOpen"}}}},
    {"id": "v-wp-out", "object": "valve", "x": 26.4, "y": 8, "handwheel": "#c0392b", "params": {"open": false}, "extensions": {"hyperdrive.bindings": {"metrics": {"open": "brewhouse-plc:Brewhouse.WpOutOpen"}}}},
    {"id": "pump-hlt", "object": "brewery:pump", "x": 5.5, "y": 8, "rotation": 3.141592653589793, "params": {"running": false, "rpm": 0}, "extensions": {"hyperdrive.bindings": {"metrics": {"running": "brewhouse-plc:Brewhouse.HltPumpRunning", "rpm": "brewhouse-plc:Brewhouse.HltPumpRpm"}}}},
    {"id": "pump-wort", "object": "brewery:pump", "x": 13.4, "y": 5, "rotation": 3.141592653589793, "params": {"running": false, "rpm": 0}, "extensions": {"hyperdrive.bindings": {"metrics": {"running": "brewhouse-plc:Brewhouse.WortPumpRunning", "rpm": "brewhouse-plc:Brewhouse.WortPumpRpm"}}}},
    {"id": "l-hlt", "object": "label", "x": 3, "y": 9.9, "params": {"text": "HLT"}, "size": 0.55, "height": 0.08, "color": "#1b1b1b"},
    {"id": "l-hlt-temp", "object": "label", "x": 3, "y": 10.75, "params": {"text": "Temp", "value": 20, "unit": "\u00b0C"}, "size": 0.5, "height": 0.08, "color": "#7a3f00", "extensions": {"hyperdrive.bindings": {"metrics": {"value": "brewhouse-plc:Brewhouse.HltTempC"}}}},
    {"id": "l-hlt-level", "object": "label", "x": 3, "y": 11.6, "params": {"text": "Level", "value": 0, "unit": "%"}, "size": 0.5, "height": 0.08, "color": "#7a3f00", "extensions": {"hyperdrive.bindings": {"metrics": {"value": "brewhouse-plc:Brewhouse.HltLevelPct"}}}},
    {"id": "l-mt", "object": "label", "x": 10, "y": 7.1, "params": {"text": "Mash tun"}, "size": 0.55, "height": 0.08, "color": "#1b1b1b"},
    {"id": "l-mt-temp", "object": "label", "x": 10, "y": 7.949999999999999, "params": {"text": "Temp", "value": 20, "unit": "\u00b0C"}, "size": 0.5, "height": 0.08, "color": "#7a3f00", "extensions": {"hyperdrive.bindings": {"metrics": {"value": "brewhouse-plc:Brewhouse.MashTunTempC"}}}},
    {"id": "l-mt-level", "object": "label", "x": 10, "y": 8.799999999999999, "params": {"text": "Level", "value": 0, "unit": "%"}, "size": 0.5, "height": 0.08, "color": "#7a3f00", "extensions": {"hyperdrive.bindings": {"metrics": {"value": "brewhouse-plc:Brewhouse.MashTunLevelPct"}}}},
    {"id": "l-kettle", "object": "label", "x": 17.5, "y": 7.1, "params": {"text": "Kettle"}, "size": 0.55, "height": 0.08, "color": "#1b1b1b"},
    {"id": "l-kettle-temp", "object": "label", "x": 17.5, "y": 7.949999999999999, "params": {"text": "Temp", "value": 20, "unit": "\u00b0C"}, "size": 0.5, "height": 0.08, "color": "#7a3f00", "extensions": {"hyperdrive.bindings": {"metrics": {"value": "brewhouse-plc:Brewhouse.KettleTempC"}}}},
    {"id": "l-kettle-level", "object": "label", "x": 17.5, "y": 8.799999999999999, "params": {"text": "Level", "value": 0, "unit": "%"}, "size": 0.5, "height": 0.08, "color": "#7a3f00", "extensions": {"hyperdrive.bindings": {"metrics": {"value": "brewhouse-plc:Brewhouse.KettleLevelPct"}}}},
    {"id": "l-wp", "object": "label", "x": 24, "y": 9.9, "params": {"text": "Whirlpool"}, "size": 0.55, "height": 0.08, "color": "#1b1b1b"},
    {"id": "l-wp-temp", "object": "label", "x": 24, "y": 10.75, "params": {"text": "Temp", "value": 20, "unit": "\u00b0C"}, "size": 0.5, "height": 0.08, "color": "#7a3f00", "extensions": {"hyperdrive.bindings": {"metrics": {"value": "brewhouse-plc:Brewhouse.WhirlpoolTempC"}}}},
    {"id": "l-wp-level", "object": "label", "x": 24, "y": 11.6, "params": {"text": "Level", "value": 0, "unit": "%"}, "size": 0.5, "height": 0.08, "color": "#7a3f00", "extensions": {"hyperdrive.bindings": {"metrics": {"value": "brewhouse-plc:Brewhouse.WhirlpoolLevelPct"}}}},
    {"id": "l-pump-hlt", "object": "label", "x": 5.5, "y": 9.1, "params": {"text": "Pump", "value": false, "format": "onoff"}, "size": 0.4, "height": 0.08, "color": "#7a3f00", "extensions": {"hyperdrive.bindings": {"metrics": {"value": "brewhouse-plc:Brewhouse.HltPumpRunning"}}}},
    {"id": "l-pump-wort", "object": "label", "x": 13.4, "y": 6.3, "params": {"text": "Pump", "value": false, "format": "onoff"}, "size": 0.4, "height": 0.08, "color": "#7a3f00", "extensions": {"hyperdrive.bindings": {"metrics": {"value": "brewhouse-plc:Brewhouse.WortPumpRunning"}}}},
    {"id": "l-state", "object": "label", "x": 13.2, "y": 11.0, "params": {"text": "Brew step:", "value": 0, "format": "int", "labels": {"0": "Heat HLT", "1": "Fill mash", "2": "Mash", "3": "To kettle", "4": "Boil", "5": "To whirlpool", "6": "Whirlpool rest", "7": "Knock out"}}, "size": 0.75, "height": 0.08, "color": "#7a3f00", "extensions": {"hyperdrive.bindings": {"metrics": {"value": "brewhouse-plc:Brewhouse.StateNum"}}}}
  ]
}
